문예진,이상민,정수연,정승연,황의린,평균,표준편차,상품명,리뷰,index
2,,,,,,,라운드랩 1025 독도 토너 대용량 500ml 기획(토너 100ml 증정),"독도토너 처음 써봤는데 자극없이 순해서 좋고, 속건조도 잡아줘서 만족합니다",5881
1,,,,,,,라운드랩 1025 독도 토너 대용량 500ml 기획(토너 100ml 증정),순하기도 순해요 근데 홍조 있는 피부에는 솜 사용하면 안좋다해서 잠시 사용을 멈췄어요 잘쓰거있어요 가성비 좋음,5882
1,,,,,,,라운드랩 1025 독도 토너 대용량 500ml 기획(토너 100ml 증정),세일할 때 저렴하게 잘 산 것 같아요. 아직 사용해보진 않았지만 만족합니다.,5883
2,,,,,,,라운드랩 1025 독도 토너 대용량 500ml 기획(토너 100ml 증정),닦토로 너무 좋아요. 순하고 향도 거의없어서 거부감도 없어요. 완전 물같은 제형이라 스킨팩하기도 좋구요. 재구매의사 있습니다.,5884
1,,,,,,,라운드랩 1025 독도 토너 대용량 500ml 기획(토너 100ml 증정),소문대로 순하고 좋은거 같아요. 스킨을 잘못바꾸면 다 뒤집어져서 걱정이었는데 아직은 괜찮아요. 계속 괜찮아서 정착하면 좋겠어요.,5885
1,,,,,,,라운드랩 1025 독도 토너 대용량 500ml 기획(토너 100ml 증정),항상 쓰는 토너입니다. 자극 없이 순해서 손이 많이 가는것 같아요. 단점은 특별히 없는것 같아요,5886
1,,,,,,,라운드랩 1025 독도 토너 대용량 500ml 기획(토너 100ml 증정),복합성 피부여서 항상 고민이었는데 이 제품 쓰고 피부도 가라앉고 화장도 들뜨지않고 잘 먹어서 애용하고 있어요.,5887
1,,,,,,,라운드랩 1025 독도 토너 대용량 500ml 기획(토너 100ml 증정),다른 히알루론산 토너들도 있지만 독도 토너가 제일 잘 맞는 거 같아요. 화장솜에 닦아 쓸 때도 좋고 바로 손으로 바를 때도 좋아요,5888
2,,,,,,,라운드랩 1025 독도 토너 대용량 500ml 기획(토너 100ml 증정),대용량을 저렴한가격에 구매해서 좋고 민감성인데 우선 순하고 자극적이지 않아요!! 가벼우면서 흡수력도 좋고 촉촉해서 좋아요!!,5889
1,,,,,,,라운드랩 1025 독도 토너 대용량 500ml 기획(토너 100ml 증정),대용량이라서 그냥 산건데 쓰다보니까 넘 좋네요 순해서 그런지 잔 트러블도 많이 가라앉고 닥토하기도 좋고 담에도 사려구용,5890
1,,,,,,,라운드랩 1025 독도 토너 대용량 500ml 기획(토너 100ml 증정),올리브영에서 할인도 하고 있어서 엄청 싸게 샀어요 !! 그리고 여행용 ? 같은거로 덤이 있어서 더 좋아요 ㅎㅎ,5891
2,,,,,,,라운드랩 1025 독도 토너 대용량 500ml 기획(토너 100ml 증정),속건조가 심한 지성피분인데 아침에 토너팩해주면 하루종일 개기름 안끼고 촉촉하고 혈색이 맑아지는 효과있어오 짱좋아요,5892
1,,,,,,,라운드랩 1025 독도 토너 대용량 500ml 기획(토너 100ml 증정),엄청 순하다!! 근데 너무 순해서 물을 그냥 바르는 느낌..? 다른 효과는 모르겠지만 순하고 자극없는 스킨인건 확실하다,5893
2,,,,,,,라운드랩 1025 독도 토너 대용량 500ml 기획(토너 100ml 증정),"자극없이 순해요~
 모든 피부에 잘 맞을 것 같아요~
 토너팩으로 가끔 하는데 보습도 되고 진정도 되요
 지성피부인 저에게는 사계절 내내 사용할 수 있는 토너인 것 같아용",5894
1,,,,,,,라운드랩 1025 독도 토너 대용량 500ml 기획(토너 100ml 증정),일단 가성비가 진짜 좋은것같아요 이번에 가성비 좋은 토너 생각하고 있었는데 독도 토너가 양이 진짜 많아서 사용하게 됬는데 피부 진정에 도움이 많이 됬어요 진짜 좋아요👍,5895
2,,,,,,,라운드랩 1025 독도 토너 대용량 500ml 기획(토너 100ml 증정),U존은 항상 당기는 복합성 피부인데 이 토너로 쓸어주고 두드려서 흡수시켜주면 로션을 따로 바르지 않아도 될 정도로 수분감이 있어서 좋아요. 트러블도 진정되는 효과가 있어요!,5896
1,,,,,,,라운드랩 1025 독도 토너 대용량 500ml 기획(토너 100ml 증정),"싸고 크고 닦토로 쓰기에 좋아요
 극도로 순해서 트러블 걱정은 없지만 더 좋아지는 효과는 없었어요",5897
2,,,,,,,라운드랩 1025 독도 토너 대용량 500ml 기획(토너 100ml 증정),"독도토너는 꾸준히 쓰고 있는데, 물토너 형식이여서 닦토로 사용하기 부담없어요. 그리고 자극없이 피부결 정리도 되고 무향이라 좋았어요.",5898
1,,,,,,,라운드랩 1025 독도 토너 대용량 500ml 기획(토너 100ml 증정),뭔지 모르겠는데 이 물같은게 아침에 기름진 얼굴 닦거나 밤에 씻고 닦으면 뭔가 보슬해지는 느낌이 들어서 계속 쓰게 돼요 ㅋㅋ 저번에 세일할때 쟁여놨숩네다,5899
1,,,,,,,라운드랩 1025 독도 토너 대용량 500ml 기획(토너 100ml 증정),"처음에는 광장히 밋밋하다고 생각했는데 
 피부에 자극이 없어 닥토용으로도 팩용으로도 좋아요
 용량도 짐승용량이라 부담없이 촵촵!!",5900
2,,,,,,,라운드랩 1025 독도 토너 대용량 500ml 기획(토너 100ml 증정),"계속 타제품 스킨 쓰다가 급하게 사서 쓴건데
 너무 괜찮았어요
 순하기도 하고 보습도 괜찮았구요
 건성인 분들은 약간 아쉬울순 있지만 나쁘지 않은 제품이에요!!
 재구매 의사도 있구요!",5901
2,,,,,,,라운드랩 1025 독도 토너 대용량 500ml 기획(토너 100ml 증정),너무 순하고 향도 별로없어서 사용하기 좋습니다! 사용감도 너무 가볍고 늘 사용하던건데 또 구매했습니다ㅎㅎ 여러사람한테 추천하고있는 제품입니다!,5902
2,,,,,,,라운드랩 1025 독도 토너 대용량 500ml 기획(토너 100ml 증정),"항상 쓰는 토너로 엄청나게 좋은 효과가 있는건 아니지만
 바르면 순하고 트러블이 안나서 계속 사용중이에요",5903
2,,,,,,,라운드랩 1025 독도 토너 대용량 500ml 기획(토너 100ml 증정),무난하고 순해서 어느 피부든 다 잘 맞을 것 같아요 뭔가 특별한 효과는 없지만 다른 것 쓰지 않게 되고 계속 이것만 쓰게 되는 마약같은 존재 에요,5904
1,,,,,,,라운드랩 1025 독도 토너 대용량 500ml 기획(토너 100ml 증정),순해서 기초 토너로 쓰기 좋아요 흡수도 잘 되고 자극도 없어요 벌써 네 병째 비우고 있어요,5905
1,,,,,,,라운드랩 1025 독도 토너 대용량 500ml 기획(토너 100ml 증정),"하도 유명한 제품이라 사봤는데 역시 좋은 이유가 있습니다! 각질도 잡아주고 뭔가 피부가 부들부들 해지는 기분이 들고, 솜에 적져서 팩으로 사용하면 정말 좋아요",5906
1,,,,,,,라운드랩 1025 독도 토너 대용량 500ml 기획(토너 100ml 증정),독도로션을 사용중이라 같은 라인으로 쓰려고 대용량으로 구매했어요. 성분도 괜찮고 데일리로 쓰기 좋은 평범한 토너에요.,5907
1,,,,,,,라운드랩 1025 독도 토너 대용량 500ml 기획(토너 100ml 증정),닦토로 사용하다가 피부가 진정되는 느낌이 들어서 그뒤로 일주일에 2-3번 스킨팩용으로도 사용하고 있어요!! 순하고 용량도 커서 다 쓰면 재구매할것같아요!ㅎㅎ,5908
1,,,,,,,라운드랩 1025 독도 토너 대용량 500ml 기획(토너 100ml 증정),좋다해서 사봤는데 트러블이 나거나 하지 않지만 좋은지도 모르겠어요..그냥 닥토로 씁니다.,5909
,,,,,,,라운드랩 1025 독도 토너 대용량 500ml 기획(토너 100ml 증정),그간 올인원 제품만 써왔는데 따로 토너를 써봤더니 번들거리는 느낌이 덜한 것 같아서 좋아요,5910
,,,,,,,라운드랩 1025 독도 토너 대용량 500ml 기획(토너 100ml 증정),몇통째 비우고있는 순하고 좋아요. 가격도 저렴하고 양도 많아서 데일리로 사용하고있어요,5911
,,,,,,,라운드랩 1025 독도 토너 대용량 500ml 기획(토너 100ml 증정),벌써 몇 통째인 모르겠어요 수부지피부에 보습 채우는 첫단계로 잘 쓰고있어요,5912
,,,,,,,라운드랩 1025 독도 토너 대용량 500ml 기획(토너 100ml 증정),200미리 순식간에 다 쓰고 재구매합니다. 촉촉하고 순하고^^ 계속 애용할듯 하네요!,5913
,,,,,,,라운드랩 1025 독도 토너 대용량 500ml 기획(토너 100ml 증정),"남자들이 쓰기 편한 토너같아요
 흡수도 잘되고 좋아요^^",5914
,,,,,,,라운드랩 1025 독도 토너 대용량 500ml 기획(토너 100ml 증정),저녁 세안 후 수분로션 부르기 전에 피부결 정리해주는 용도로 사용하고 있어요 깔끔하고 순해요,5915
,,,,,,,라운드랩 1025 독도 토너 대용량 500ml 기획(토너 100ml 증정),"독도 토너는 말모말모 말해뭐해요ㅠㅠ
 자극없이 순하게 쓱 발리는게 최고쥬
 닦토하기 더할 나위 없이 좋은 토너!",5916
,,,,,,,라운드랩 1025 독도 토너 대용량 500ml 기획(토너 100ml 증정),토너 어떤거 쓰느냐에 따라 민감정도가 달라지는 피부인데 보습이랑 진정 잘 되서 좋아요 여기 정착할 것 같아요,5917
,,,,,,,라운드랩 1025 독도 토너 대용량 500ml 기획(토너 100ml 증정),피부가 눈에 띄게 좋아진다고나 하는건 없는데 트러블이 올라오지 않아 좋아요 계속 구매하고있어요!,5918
,,,,,,,라운드랩 1025 독도 토너 대용량 500ml 기획(토너 100ml 증정),"여름이 되면 생각나는 토너에요, 자극없이 순하고 각질정리까지 해주니 ㅍ잘사용하고 있어요! 주변사람에게 추천해주는 제품이에요",5919
,,,,,,,라운드랩 1025 독도 토너 대용량 500ml 기획(토너 100ml 증정),두번째 사는건데 순하고 너무 좋아요!! 세수하고 이것만 발라줘도 촉촉하고 좋아요 계속쓰려구용,5920
,,,,,,,라운드랩 1025 독도 토너 대용량 500ml 기획(토너 100ml 증정),벌써 몇통째 구매인지 모르겠네.. 그냥저냥 세일할때마다 사서 쓰는편인데 순하고 부담없어서 좋아요,5921
,,,,,,,라운드랩 1025 독도 토너 대용량 500ml 기획(토너 100ml 증정),처음 구매합니다. 매장에서 할인하길래 구입했는데 어느 피부타입이던 무난하게 쓸 수 있을 것 같아요.,5922
,,,,,,,라운드랩 1025 독도 토너 대용량 500ml 기획(토너 100ml 증정),"피부 뒤집어지기 전에도, 후에도 꾸준히 사용하고 있어용 그만큼 엄청난 효과를 볼 수는 없지만 자극도 없어서 딱 기본토너로 사용하기 너무너무 좋습니당ㅎㅎㅎ",5923
,,,,,,,라운드랩 1025 독도 토너 대용량 500ml 기획(토너 100ml 증정),써보고 좋아서 동생한테도 사줬어요ㅎㅎ 용량이크지만 저는 스킨팩으로 팍팍써서 금방줄어드네영 ㅎㅎ ㅠ,5924
,,,,,,,라운드랩 1025 독도 토너 대용량 500ml 기획(토너 100ml 증정),물제형의 닦토입니다. 피부에 피지랑 여드름이 많아 항상 고민이 많은 피부인데 이 토너는 자극이 없어서 너무 좋아요.,5925
,,,,,,,라운드랩 1025 독도 토너 대용량 500ml 기획(토너 100ml 증정),"자극 없이 화장솜에 묻혀 닦아 내도 
 전혀 자극이 없고 순해서 꾸준히 사용하는
 제품이에요~",5926
,,,,,,,라운드랩 1025 독도 토너 대용량 500ml 기획(토너 100ml 증정),"제가 제일 좋아하고 잘 쓰고 있는 토너예요
 피부결 정돈 피지 조절 수분감등 너무 만족하고 계속 쓸거예요",5927
,,,,,,,라운드랩 1025 독도 토너 대용량 500ml 기획(토너 100ml 증정),"향이 강하지 않아서 좋았어요!
 끈적이지 않고 닦토하는 데 사용하기 아주 좋았습니당
 순해서 누구든 사용하는 데 무리 없을 것 같습니다!",5928
,,,,,,,라운드랩 1025 독도 토너 대용량 500ml 기획(토너 100ml 증정),자극 없다는게 최고ㅜㅜ 다른 장점도 별로 생각나지 않지만 어느 계절이나 무난히 쓸 수 있는 게 좋아요,5929
,,,,,,,라운드랩 1025 독도 토너 대용량 500ml 기획(토너 100ml 증정),2통째 쓰고있습니다. 대용량이라서 좋고 성분도 순해서 민감성에도 괜찮을것같아요!! 닦토로 쓸려고 샀는데 수분감이 많아서 스킨팩 해도 괜찮을것같아요!,5930
,,,,,,,라운드랩 1025 독도 토너 대용량 500ml 기획(토너 100ml 증정),인생토너에요! 자극 없고 알게모르게 각질제거도 됩니당. 티트리 부작용으로 난리났던 피부를 진정시켜준 토너!,5931
,,,,,,,라운드랩 1025 독도 토너 대용량 500ml 기획(토너 100ml 증정),솔직히 기대많이했는데 좋긴좋았지만 드라마틱하게 너~~무좋고 요런건 없었어서 아쉬워용 물토너로 닥토나 스킨팩 하시는분들! 꼭 화장솜은 스펀지화장솜으로!!! 아시겧어요?,5932
,,,,,,,라운드랩 1025 독도 토너 대용량 500ml 기획(토너 100ml 증정),초등학생인 동생이 이거 많이 쓴다고 해서 사서 사용하는데 순하고 보습도 괜찮다고 하더라구요👍🏻👍🏻🤭🤭,5933
,,,,,,,라운드랩 1025 독도 토너 대용량 500ml 기획(토너 100ml 증정),역시 독도토너네요. 이렇게 순하고 상쾌한 토너는 진짜 처음이에요. 세안 후에 화장솜에 뭍혀서 얼굴에 대는 순간 피부가 상쾌해지는 것을 느낄수 있다랄까. 인생 토너임에 확신해요,5934
,,,,,,,라운드랩 1025 독도 토너 대용량 500ml 기획(토너 100ml 증정),"1. 엄청 순하다.
 여드름 피부인 저에게도 잘 맞는 제품이에요!!!
 
 2. 복합성 건성 지성 다 잘맞습니다!!
 특히 복합성인 저에게는 수분과 보습 둘다 만족했어여!",5935
,,,,,,,라운드랩 1025 독도 토너 대용량 500ml 기획(토너 100ml 증정),"토너 유목민이였는데 정착했어용,,,, 트러블 잘나는 피부였는데 이거쓰고 트러블이 조금은 줄은것 같아용 만족쓰",5936
,,,,,,,라운드랩 1025 독도 토너 대용량 500ml 기획(토너 100ml 증정),겨울엔 자작나무 어쩌구 쓰고 나머지때는 이거쓰면될것같아요 속당김잡아주는 느낌도있고 닦토하면서 진정이랑 결정돈 다 할수있는 무난한제품인것같습니다,5937
,,,,,,,라운드랩 1025 독도 토너 대용량 500ml 기획(토너 100ml 증정),막쓰기 좋은 가벼운 토너제품 찾다가 순하다길래 도전해본 토너였는데 지금은 정착템이 되버린 토너,5938
,,,,,,,라운드랩 1025 독도 토너 대용량 500ml 기획(토너 100ml 증정),손에 적정량 덜어서 흡수시킵니다. 피부가 매끈해지고 촉촉해집니다. 화장도 더 잘 먹는 느낌이에요!,5939
,,,,,,,라운드랩 1025 독도 토너 대용량 500ml 기획(토너 100ml 증정),토너라 막 피부가 개선된다는 느낌은 없지만 그래도 없으면 또 안되는 기본템이랄까용 딱히 자극없이 매일 편하게 쓰기 좋아요,5940
,,,,,,,라운드랩 1025 독도 토너 대용량 500ml 기획(토너 100ml 증정),닥토하기에 좋은 토너....크게 안 좋은 점을 발견하지 못해서 쭉 쓰고있습니다 아침저녁으로 얼굴 닦으니 큰 용량이라도 꽤 금방 쓰네요,5941
,,,,,,,라운드랩 1025 독도 토너 대용량 500ml 기획(토너 100ml 증정),깨끗하게 피부가 정리되면서 느낌도 부드러워서 좋아요. 아직 얼마 안 썼지만 피부 보습에도 도움이 되는 거 같아 좋아요.,5942
,,,,,,,라운드랩 1025 독도 토너 대용량 500ml 기획(토너 100ml 증정),대용량인 부분도 좋았고 아직 많이 사용해보지는 않아서 잘 모르겠지만 화장솜에 묻혀서 5-10분 얹어놓고 화장하면 뭔가 촉촉히 더 화장이 잘 먹는 느낌입니다. 계속 사용할게요~,5943
,,,,,,,라운드랩 1025 독도 토너 대용량 500ml 기획(토너 100ml 증정),"중1 된 딸이 항상 관리하느라 바르고 있어요.
 독도 토너 믿고 쓰고 있어요
 벌써 3번째 구매예요",5944
,,,,,,,라운드랩 1025 독도 토너 대용량 500ml 기획(토너 100ml 증정),"처음에 쓸 땐 물 같아서 이게 효과가 있는건가 싶었는데
 다른 토너 쓰니까 바로 얼굴에 뭐가 나더라고요
 결국 독도토너 재구매 했어요 향도 없어서 좋아요",5945
,,,,,,,라운드랩 1025 독도 토너 대용량 500ml 기획(토너 100ml 증정),자극없는 순한제품 사용해보려고 추천받아 구매해봤어요~ 처음써보는 제품이라 좀 사용해봐야겠네요!,5946
,,,,,,,라운드랩 1025 독도 토너 대용량 500ml 기획(토너 100ml 증정),"팍팍 막 쓰기좋지만 기본에 충실한 제품!
 이거쓰고 크림만 잘 발라줘도 여름 기초 끝!
 잘 쓸게요~~",5947
,,,,,,,라운드랩 1025 독도 토너 대용량 500ml 기획(토너 100ml 증정),화장솜에 적셔서 닦아내면 확실히 피부가 더부드럽구요 지 복합성 피부에 사용하기 좋은것같인요 여름에 깔끔하게 쓰기좋은것같아요 향은 쎄지는 않아요,5948
,,,,,,,라운드랩 1025 독도 토너 대용량 500ml 기획(토너 100ml 증정),워낙 민감한 피부라 아무거나 쓰기 힘든데 이건 자극없이 순해서 넘 맘에 들어요 금방 써서 이번엔 대용량로 구입했네요,5949
,,,,,,,라운드랩 1025 독도 토너 대용량 500ml 기획(토너 100ml 증정),"이 토너는 호불호 안갈릴 토너예요!!!
 기대안했는데 생각보다 좋아서 놀랬어요ㅎㅎㅎ
 대용량이라 언제 다쓸지 모르겠지만 다쓰면 재구매 의향 있어요!",5950
,,,,,,,라운드랩 1025 독도 토너 대용량 500ml 기획(토너 100ml 증정),"언니가 필요하다고해서 선물로 사줬는데 너무 좋다고해요ㅎ
 저도 나중에 구매해서 사용해봐야겠어영",5951
,,,,,,,라운드랩 1025 독도 토너 대용량 500ml 기획(토너 100ml 증정),"진짜 순하고 닦토하기 좋아요
 용량도 꽤 커서 진짜 만족
 매일 닦토하는 저는 토너 이것만 씀",5952
,,,,,,,라운드랩 1025 독도 토너 대용량 500ml 기획(토너 100ml 증정),"평소 자주 쓰던 제품으로 재구매했어요
 대용량에 물 같은 사용감으로 닦토로 아주 잘 쓰고 있답니다",5953
,,,,,,,라운드랩 1025 독도 토너 대용량 500ml 기획(토너 100ml 증정),순하고 촉촉해서 세안후에 사용하기 아주 좋고 항상 세일때마다 구매해서 쟁여두는 제품입니다~~,5954
,,,,,,,라운드랩 1025 독도 토너 대용량 500ml 기획(토너 100ml 증정),원래 토너 사용 안 하다가 우연히 독도토너 사용 후 진정 효과 보고 나서 필수템 됐어요 !!! 자극 없이 순한 토너 찾으시면 독도 토너가 제일 좋아요,5955
,,,,,,,라운드랩 1025 독도 토너 대용량 500ml 기획(토너 100ml 증정),"여름에 산뜻하게 쓰기 좋은 스킨이고
 순해서 제일 좋아요
 그리고 얼굴에 열이 많이 날때에는
 화장솜 듬뿍 젹셔서 냉동실에 넣어놓고
 샤워후 얼굴에 붙이고 있으면 짱이예요 ^^",5956
,,,,,,,라운드랩 1025 독도 토너 대용량 500ml 기획(토너 100ml 증정),"여러 토너들 사용해 봤는데, 이 제품은 기대이상으로 만족이에요! 솜에 묻혀서 얼굴을 닦자마자 보습되는게 느껴져서 너무 좋아요",5957
,,,,,,,라운드랩 1025 독도 토너 대용량 500ml 기획(토너 100ml 증정),"닥토에 좋다고 해서 내심 궁금했는데
 
 이제 써보게 되었네요
 
 클렌징많으로는 안심할수 없었는데
 
 독토 토너가 있어 안심입니다
 
 다불어 아침에는 클렌징 대용으로 가볍게 닦아줍니다",5958
,,,,,,,라운드랩 1025 독도 토너 대용량 500ml 기획(토너 100ml 증정),"ㅜㅜ생각보다 좋은 평들에 비해 ..
 기대보다는 좀 못했어요 그래도 막 물같지 않고 보습이 되어서 괜찮은 것 같아요~",5959
,,,,,,,라운드랩 1025 독도 토너 대용량 500ml 기획(토너 100ml 증정),순해서 민감한 피부에도 잘 맞을것같아요. 다만 저는 복합성 피부인데 보습력은 부족한것 같아요. 향도 없고 그냥 물 바르는 느낌이랄까... 저는 재구매 의사는 없어요ㅠ,5960
,,,,,,,라운드랩 1025 독도 토너 대용량 500ml 기획(토너 100ml 증정),리뷰가 많아서 학생 신분으론 약간 비싸지만 믿져야 본전인 마음으로 구매했는데 일단 잘 스며들고 순해요 화장도 좀 잘 먹는 느낌이예여 아직 삼일밖에 안 되었지만 만족합니다,5961
,,,,,,,라운드랩 1025 독도 토너 대용량 500ml 기획(토너 100ml 증정),역시 믿고쓰는 독도 스킨 로션이에용. 완전 순하고 자극 없이 좋아요. 4통째 쓰는 중인데 이거 다 쓰면 또 살거에용 추천!,5962
,,,,,,,라운드랩 1025 독도 토너 대용량 500ml 기획(토너 100ml 증정),"닥터지 블레미쉬 토너랑 이거랑 고민하다가 독도토너 삼
 진정이랑 수분이 더 집중적으로 되는건 닥터지인듯?",5963
,,,,,,,라운드랩 1025 독도 토너 대용량 500ml 기획(토너 100ml 증정),"독도 토너 좋다는 얘기 많이 들어봐서 구매 해봤습니다!
 역시 소문대로 좋아요~ 피부결 정리되고 촉촉합다!",5964
,,,,,,,라운드랩 1025 독도 토너 대용량 500ml 기획(토너 100ml 증정),"늘 닥토로 애용하는 토너입니다. 복합성 수부지 피부라 클린징 후 마무리 한번이 중요한데, 독도 토너로 닥토 하고 나면 피부가 깨끗해진 느낌이에요. 다음 기초도 잘 받구요.",5965
,,,,,,,라운드랩 1025 독도 토너 대용량 500ml 기획(토너 100ml 증정),전채적으로 무난해요. 어떤 타입이 써도 될 것 같은. 저는 건성이고 닥터ㅈ 제품을 썼을 때는 붉은 트러블이 생겼었는데요. 이 제품은 더 순한 거 같아요. 향도 없고 무해한 느낌ㅎ,5966
,,,,,,,라운드랩 1025 독도 토너 대용량 500ml 기획(토너 100ml 증정),"키엘 카렌듈라토너 쓰다가 다른거 써보려고 여기저기 이동했었는데, 독도토너가 자극 없이 순하고 피부에 보습력이 좋은 것 같아요. 500미리 3벌째 사용중입니다.",5967
,,,,,,,라운드랩 1025 독도 토너 대용량 500ml 기획(토너 100ml 증정),저 피부 복합성 완전 약한데 이거 물같이 되게 순하고 좋아요!!그냥 전체적으로 물같달깡 되게 좋아요!! 누구나 다 쓸 수 있을 것 같아요!!!,5968
,,,,,,,라운드랩 1025 독도 토너 대용량 500ml 기획(토너 100ml 증정),재구매했어요!! 매번 스킨떨어질때마다 고민했는데 이제 고민안해요 ㅠㅠ,5969
,,,,,,,라운드랩 1025 독도 토너 대용량 500ml 기획(토너 100ml 증정),"왜 독도토너독도토너 하는지 알겠네요
 속건조도 잡아주고 진짜 좋아요 엄청 순합니다",5970
,,,,,,,라운드랩 1025 독도 토너 대용량 500ml 기획(토너 100ml 증정),하도 유명해서 기획으로나온거 한번 써보려구 구매해요 ㅎ 좋은거갘아요,5971
,,,,,,,라운드랩 1025 독도 토너 대용량 500ml 기획(토너 100ml 증정),평소 토너에 대한 기대 없었는데 너무 젛아요!!,5972
,,,,,,,라운드랩 1025 독도 토너 대용량 500ml 기획(토너 100ml 증정),여드름난 사춘기 중딩딸이 쓰는데 순하고 자극이 없어서 좋아하네요~,5973
,,,,,,,라운드랩 1025 독도 토너 대용량 500ml 기획(토너 100ml 증정),자극없이 순해서 닦토로도 쓰고 3스킨 하고있어요,5974
,,,,,,,라운드랩 1025 독도 토너 대용량 500ml 기획(토너 100ml 증정),트러블도 딱히 안나고 좋은거같아요! 알콜향도 없어서 자극도 없고 순해요,5975
,,,,,,,라운드랩 1025 독도 토너 대용량 500ml 기획(토너 100ml 증정),"독도토너 예전부터 썼다가, 고쿠쥰으로 바꾼 후로 갑자기 얼굴이 붉어지고 머가 자꾸 올라와서 다시 급하게 독도로 바꿨는데, 3일?만에 피부 돌아왔어여 ㅠㅠ 저는 참고로 복합성입니당",5976
,,,,,,,라운드랩 1025 독도 토너 대용량 500ml 기획(토너 100ml 증정),물같은 제형이고요 바르면 수분이 채워지는 기분이 듭니다. 저는 여러번 덧발라주면서 수분보충하고 있어요! 순한제품이라는게 느껴집니다. 강추!,5977
,,,,,,,라운드랩 1025 독도 토너 대용량 500ml 기획(토너 100ml 증정),"발써 두통째 쓰고 잇어요~만족하고 너무 마음에 들어요 주위에도 소개시켜주고 싶은 제춤이랍니다
 저는 복합성인데 잘 맞아요~^^
 보통 여름 가을에 제일 잘 맞아오
 굿굿",5978
,,,,,,,라운드랩 1025 독도 토너 대용량 500ml 기획(토너 100ml 증정),독도토너 3통째에요 ㅠ ㅠ 자극도 없고 큰 여드름이 자주 나는 피부인데 진정에 엄청 효과적이진 않지만 그래도 각질케어에 도움되는 것 같아요,5979
,,,,,,,라운드랩 1025 독도 토너 대용량 500ml 기획(토너 100ml 증정),몇번째 재구매인데 물같이 흘러내리는 타입이에요. 세수하고 닦토로 한번 사용한뒤 그냥 얼굴에 다시한번 발라줍니다 무색무취 성분좋은 무난템으로 딱이에요,5980
,,,,,,,라운드랩 1025 독도 토너 대용량 500ml 기획(토너 100ml 증정),얼굴에 물바르는 느낌?? 그만큼 자극이 없고 순한거겠죠?,5981
